Column 1,item_id,stem,option_a,fb_a,option_b,fb_b,option_c,fb_c,option_d,fb_d,correct,rationale,rationale_img,subject,topic,difficulty,marks,instant_id,timed_id
,GP-S4-21,Primary role of a nurse during CPR?,Administer IV fluids,"Incorrect – fluids are supportive, not immediate in CPR.",Write time of arrest,Incorrect – documentation is secondary.,Provide chest compressions & rescue breaths,Correct – nurses initiate CPR with high-quality compressions/ventilations.,,,C,"Nursing responsibility in CPR is immediate resuscitation (compressions, breaths, AED use).",,FUND – BLS,Fundamentals: BLS,Hard,,GP-F-I1,GP-F-T4
,GP-S4-22,Which system controls hormones?,Respiratory,Incorrect – regulates gas exchange.,Circulatory,Incorrect – transports hormones but doesn’t produce them.,Endocrine,Correct – glands secrete hormones into bloodstream.,,,C,"Endocrine system (pituitary, thyroid, pancreas, etc.) regulates hormones.",,MED – Endocrinology,Medicine: Endocrinology,Easy,,GP-F-I1,GP-F-T4
,GP-S4-23,Apical pulse checked for 1 min when:,Patient is sleeping,Incorrect – not a reason.,Taking temperature,Incorrect – unrelated.,Giving digoxin/cardiac meds,Correct – full apical pulse ensures safe dosing.,,,C,Apical HR is checked before digoxin to prevent bradycardia/arrhythmias.,,MED – Cardiovascular,Medicine: Cardiovascular,Moderate,,GP-F-I1,GP-F-T4
,GP-S4-24,Body position for best lung expansion?,Supine,Incorrect – restricts expansion.,Lateral,Incorrect – partial expansion only.,High Fowler’s,Correct – upright sitting promotes full expansion.,,,C,High Fowler’s allows diaphragm descent and maximum lung inflation.,,MED – Resp Support,Medicine: Resp Support,Easy,,GP-F-I1,GP-F-T4
,GP-S4-25,What is a nosocomial infection?,Infection caught during surgery,Incorrect – not all are surgical.,Hospital-acquired infection,Correct – develops ≥48 hrs after admission.,Viral flu,Incorrect – community-acquired.,,,B,"Nosocomial infections (e.g., MRSA, VAP, CAUTI) arise in hospitals.",,FUND – IPC,Fundamentals: IPC,Easy,,GP-F-I1,GP-F-T4
,GP-S4-26,Normal adult urine output/day?,200–400 mL,"Incorrect – too low, suggests oliguria.",1000–2000 mL,Correct – expected range in healthy adults.,3000–4000 mL,Incorrect – polyuria unless excessive intake.,,,B,Average adult excretes 1–2 L/day; deviations indicate renal/fluid issues.,,FUND – Renal/Elimination,Fundamentals: Renal/Elimination,Easy,,GP-F-I1,GP-F-T4
,GP-S4-27,Universal sign for choking?,Coughing loudly,Incorrect – airway still partially open.,Clutching throat,Correct – internationally recognized choking sign.,Hands on chest,Incorrect – non-specific.,,,B,"Victims instinctively clutch throat when choking, signaling obstruction.",,FUND – First Aid,Fundamentals: First Aid,Easy,,GP-F-I1,GP-F-T4
,GP-S4-28,Nutrient important for wound healing?,Carbohydrates,Incorrect – provide energy but not main tissue repair.,Fats,"Incorrect – needed for energy, not primary for repair.",Proteins,Correct – essential for tissue regeneration.,,,C,"Protein builds collagen and new tissue, vital for healing.",,NUTR – Wound Healing,Nutrition: Wound Healing,Easy,,GP-F-I1,GP-F-T4
,GP-S4-29,GCS assesses?,Skin turgor,Incorrect – assesses hydration.,Consciousness level,"Correct – via eye, verbal, motor responses.",Lung capacity,"Incorrect – respiratory function, not GCS.",,,B,GCS (3–15) quantifies consciousness; low scores = coma/severe injury.,,FUND – Neuro Assessment,Fundamentals: Neuro Assessment,Moderate,,GP-F-I1,GP-F-T4
,GP-S4-30,Priority during fire in hospital?,Call fire service,Incorrect – alarm is after rescue.,Rescue clients in danger,Correct – RACE principle: Rescue first.,Document the incident,Incorrect – later step.,,,B,RACE: Rescue → Alarm → Confine → Extinguish/Evacuate.,,FUND – Safety/Disaster,Fundamentals: Safety/Disaster,Moderate,,GP-F-I1,GP-F-T4
,GP-S4-31,Key principle when delegating a task?,It’s done quickly,Incorrect – speed not priority.,Person competent & permitted,Correct – delegation must be safe/legal.,Task written down,Incorrect – documentation is separate.,,,B,Delegation requires competence verification and clear responsibility.,,FUND – Management,Fundamentals: Management,Moderate,,GP-F-I1,GP-F-T4
,GP-S4-32,Example of legal consent?,Hidden consent,Incorrect – not valid.,Implied consent,Correct – inferred in emergencies/procedures.,Delayed consent,Incorrect – not a legal category.,,,B,"Consent can be expressed, implied, or written; implied = inferred from actions.",,FUND – Ethics/Legal,Fundamentals: Ethicsics/Legal,Easy,,GP-F-I1,GP-F-T4
,GP-S4-33,SOAP stands for?,"Subject, Observation, Action, Plan",Incorrect – not correct.,"Subjective, Objective, Assessment, Plan",Correct – structured clinical note format.,"Signs, Outcome, Analysis, Progress",Incorrect – distractor.,,,B,SOAP organizes patient documentation systematically.,,FUND – Documentation,Fundamentals: Documentation,Easy,,GP-F-I1,GP-F-T4
,GP-S4-34,Regulator of nursing practice in Ghana?,Ministry of Education,"Incorrect – oversees education, not licensing.",Ghana Health Service,Incorrect – manages service delivery.,Nursing & Midwifery Council (NMC),Correct – regulates standards/licensure.,,,C,"NMC Ghana ensures safe, ethical nursing/midwifery practice.",,FUND – Regulation,Fundamentals: Regulation,Easy,,GP-F-I1,GP-F-T4
,GP-S4-35,Muscle used for IM injections in adults?,Trapezius,"Incorrect – unsafe, too small.",Deltoid,Incorrect – small volume site only.,Gluteus medius,"Correct – safe, large muscle mass.",,,C,Gluteus medius (ventrogluteal site) preferred for IM injections.,,FUND – Procedures,Fundamentals: Procedures,Moderate,,GP-F-I1,GP-F-T4
,GP-S4-36,What is triage?,Transferring patients,Incorrect – not triage.,Prioritizing patients by urgency,Correct – assigns care by severity.,Cleaning wounds,"Incorrect – treatment, not triage.",,,B,Triage ensures the sickest/most urgent are managed first.,,FUND – Emergency Nursing,Fundamentals: Emergency Nursing,Easy,,GP-F-I1,GP-F-T4
,GP-S4-37,Preventing UTI in catheterized patients?,Daily antibiotics,Incorrect – not recommended.,Sterile technique during insertion,Correct – most effective prevention.,Irrigating catheter daily,Incorrect – increases infection risk.,,,B,Aseptic insertion + minimal duration prevents CAUTIs.,,FUND – IPC,Fundamentals: IPC,Moderate,,GP-F-I1,GP-F-T4
,GP-S4-38,“PRN” means:,Before meals,Incorrect – AC/PC indicate this.,As needed,Correct – pro re nata = when necessary.,In the morning,Incorrect – mane means morning.,,,B,PRN orders allow flexible dosing when symptoms arise.,,PHARM – Documentation,PHARM: Documentation,Easy,,GP-F-I1,GP-F-T4
,GP-S4-39,Low sodium diet is important for:,Diabetes,Incorrect – controlled by carbs/insulin.,Hypertension,Correct – Na⁺ restriction reduces BP.,Anemia,"Incorrect – linked to iron, not Na⁺.",,,B,Sodium restriction helps control hypertension and fluid retention.,,MED – Cardiovascular,Medicine: Cardiovascular,Easy,,GP-F-I1,GP-F-T4
,GP-S4-40,Normal pH of blood?,6.8,Incorrect – incompatible with life.,7.35–7.45,Correct – normal slightly alkaline range.,8.1,"Incorrect – too alkaline, not physiologic.",,,B,Blood pH tightly regulated between 7.35–7.45; deviations cause acidosis/alkalosis.,,MED – Physiology,Medicine: Physiology,Moderate,,GP-F-I1,GP-F-T4
,GP-S4-41,A patient with difficulty speaking has:,Apnea,Incorrect – refers to absence of breathing.,Aphasia,Correct – inability to speak or understand language.,Ataxia,"Incorrect – lack of coordination, not speech.",,,B,"Aphasia is loss of ability to express/understand speech, often from stroke/brain injury.",,MED – Neuro Disorders,Medicine: Neuro Disorders,Moderate,,GP-F-I1,GP-F-T4
,GP-S4-42,Most accurate method to assess fluid balance?,Checking skin turgor,Incorrect – less reliable in elderly/ill.,Observing edema,"Incorrect – subjective, late sign.",Monitoring daily weight,Correct – sensitive measure of volume status.,,,C,Daily weight detects subtle fluid changes; best indicator of balance in critically ill.,,FUND – Fluid/Electrolytes,Fundamentals: Fluid/Electrolytes,Moderate,,GP-F-I1,GP-F-T4
,GP-S4-43,Which breaks the chain of infection at “mode of transmission”?,Handwashing,Correct – interrupts spread between patients/surfaces.,Immunization,"Incorrect – reduces susceptibility, not transmission.",Nutrition,"Incorrect – improves host defense, not transmission.",,,A,Hand hygiene is the single most effective infection prevention step.,,FUND – IPC,Fundamentals: IPC,Easy,,GP-F-I1,GP-F-T4
,GP-S4-44,Nurse sees colleague slap patient. First action?,Confront colleague,"Incorrect – not first step, could escalate.",Ignore it,Incorrect – unsafe/unethical.,Report immediately to nurse manager,Correct – protects patient rights and ensures accountability.,,,C,Abuse must be reported promptly; safeguarding patient safety is priority.,,FUND – Ethics/Legal,Fundamentals: Ethicsics/Legal,Hard,,GP-F-I1,GP-F-T4
,GP-S4-45,Safest way to identify patient pre-procedure?,Ask nurse,Incorrect – prone to error.,Look at bed number,"Incorrect – unreliable, bed assignment may change.",Check wristband & ask patient’s name,Correct – double identifiers reduce error.,,,C,Proper ID uses two identifiers (name + wristband).,,FUND – Safety,Fundamentals: Safety,Easy,,GP-F-I1,GP-F-T4
,GP-S4-46,When is nurse legally responsible for a med error?,Always,Correct – nurses are accountable for their practice.,Only if patient dies,Incorrect – harm severity doesn’t remove responsibility.,If reported by colleague,Incorrect – duty exists regardless of report.,,,A,Professional accountability means nurses answer for all actions/errors.,,FUND – Ethics/Legal,Fundamentals: Ethicsics/Legal,Hard,,GP-F-I1,GP-F-T4
,GP-S4-47,Best way to ensure NG tube is in stomach?,Ask patient,Incorrect – unreliable.,Aspirate gastric contents & test pH,Correct – gold standard at bedside.,Look at tube length,Incorrect – can be misleading.,,,B,Gastric aspirate pH ≤5.5 confirms gastric placement; air auscultation is unsafe.,,FUND – Procedures,Fundamentals: Procedures,Hard,,GP-F-I1,GP-F-T4
,GP-S4-48,Symptom of hypoglycemia?,Dry skin,Incorrect – more in dehydration.,Deep breathing,Incorrect – Kussmaul respirations in DKA.,Sweating & confusion,Correct – adrenergic + neuroglycopenic symptoms.,,,C,"Hypoglycemia causes tremors, sweating, confusion; must act quickly.",,MED – Endocrinology,Medicine: Endocrinology,Moderate,,GP-F-I1,GP-F-T4
,GP-S4-49,Best pulse site to assess foot circulation?,Brachial,Incorrect – arm pulse.,Dorsalis pedis,Correct – located on dorsum of foot.,Carotid,"Incorrect – neck pulse, central not distal.",,,B,Dorsalis pedis pulse assesses peripheral circulation in lower limbs.,,MED – Peripheral Vascular,Medicine: Peripheral Vascular,Easy,,GP-F-I1,GP-F-T4
,GP-S4-50,Sign of dehydration?,Moist skin,Incorrect – opposite of dehydration.,Decreased skin turgor,Correct – poor elasticity indicates fluid loss.,High BP,Incorrect – dehydration usually causes low BP.,,,B,"Dehydration signs: poor turgor, dry mucosa, oliguria, tachycardia.",,FUND – Assessment,Fundamentals: Assessment,Easy,,GP-F-I1,GP-F-T4
,GP-S4-51,Legal term for “failure to act reasonably”?,Assault,Incorrect – threat of harm.,Fraud,Incorrect – intentional deception.,Negligence,Correct – failure to meet standard of care.,,,C,Negligence = harm due to omission or substandard care.,,FUND – Ethics/Legal,Fundamentals: Ethicsics/Legal,Hard,,GP-F-I1,GP-F-T4
,GP-S4-52,“Informed consent” requires:,Emergency situation,"Incorrect – this may waive consent, not define it.","Patient understanding, voluntariness & capacity",Correct – essentials of informed consent.,Relative’s permission,Incorrect – only valid if patient lacks capacity.,,,B,"Valid consent: informed, voluntary, competent.",,FUND – Ethics,Fundamentals: Ethicsics,Moderate,,GP-F-I1,GP-F-T4
,GP-S4-53,Goal of patient education?,Make patients passive,Incorrect – opposite of goal.,Increase hospital stay,Incorrect – education reduces complications.,Promote independence in health management,Correct – empowers patients.,,,C,"Education enables self-care, adherence, and informed decision-making.",,FUND – Education,Fundamentals: Education,Easy,,GP-F-I1,GP-F-T4
,GP-S4-54,Which fluid is isotonic?,D10W,Incorrect – hypertonic.,Normal saline (0.9% NaCl),Correct – isotonic with plasma.,0.45% NaCl,Incorrect – hypotonic.,,,B,Isotonic fluids maintain intravascular volume without fluid shifts.,,FUND – IV Therapy,Fundamentals: IV Therapy,Moderate,,GP-F-I1,GP-F-T4
,GP-S4-55,First step in medication error?,Hide error,"Incorrect – unsafe, unethical.",Report to colleague,Incorrect – bypasses patient safety.,Assess the patient,"Correct – safety first, then report.",,,C,Patient status is assessed before notification/documentation.,,FUND – Safety/Medication,Fundamentals: Safety/Medicineication,Hard,,GP-F-I1,GP-F-T4
,GP-S4-56,Item requiring medical asepsis?,Inserting central line,Incorrect – requires surgical asepsis.,Emptying bedpan,Correct – clean technique adequate.,Catheter insertion,Incorrect – requires sterile technique.,,,B,Medical asepsis = clean technique; surgical asepsis = sterile.,,FUND – IPC,Fundamentals: IPC,Easy,,GP-F-I1,GP-F-T4
,GP-S4-57,Most important step in giving injection?,Explain side effects,"Incorrect – important, but secondary.",Identify correct patient,Correct – prevents wrong-patient errors.,Shake vial,"Incorrect – not always needed, and secondary.",,,B,Patient identification is the primary safety step in all procedures.,,FUND – Safety,Fundamentals: Safety,Easy,,GP-F-I1,GP-F-T4
,GP-S4-58,A living will is:,Birth certificate,Incorrect – civil document.,Advance directive for care,Correct – states wishes if incapacitated.,Court document,Incorrect – not legal directive for healthcare.,,,C,Living will guides treatment at end-of-life when patient cannot speak.,,FUND – Ethics/Legal,Fundamentals: Ethicsics/Legal,Moderate,,GP-F-I1,GP-F-T4
,GP-S4-59,Sign of infection at wound site?,Dryness,Incorrect – expected in healing.,Redness & warmth,Correct – hallmark of infection.,Paleness,"Incorrect – may indicate ischemia, not infection.",,,B,"Infection signs: redness, swelling, pain, warmth, pus.",,SURG – Wound Care,Surgery: Wound Care,Easy,,GP-F-I1,GP-F-T4
,GP-S4-60,First action when patient falls?,Check shoes,Incorrect – not priority.,Assess for injury,Correct – immediate safety and assessment.,Call family,Incorrect – after care is provided.,,,B,"Safety assessment comes first; then notify physician, document, and inform family.",,FUND – Safety,Fundamentals: Safety,Moderate,,GP-F-I1,GP-F-T4
,GP-S4-61,"When a patient is on strict intake and output monitoring, the nurse should:",Estimate intake,Incorrect – estimations are unreliable.,Measure & document all fluids in/out,Correct – ensures accurate tracking.,Record only IV fluids,Incorrect – excludes oral/other fluids.,Only monitor urine,"Incorrect – ignores other outputs (e.g., vomit, drains).",B,Accurate I/O records help detect fluid/electrolyte imbalances early.,,FUND – Fluid Balance,Fundamentals: Fluid Balance,Moderate,,GP-F-I1,GP-F-T4
,GP-S4-62,Standard method for disposing of sharps?,Black plastic bag,Incorrect – unsafe.,Puncture-resistant sharps container,Correct – prevents injury & infection.,Burn them,Incorrect – uncontrolled burning risks exposure.,Flush in toilet,"Incorrect – unsafe, not allowed.",B,"Sharps must go into a puncture-proof, labelled sharps bin immediately after use.",,FUND – Infection Prevention,Fundamentals: Infection Prevention,Easy,,GP-F-I1,GP-F-T4
,GP-S4-63,A patient who refuses treatment has the right to:,Be forced to accept care,Incorrect – violates autonomy.,Make informed decisions,Correct – autonomy respected.,Be left alone,Incorrect – nurse still provides support.,Lose insurance,Incorrect – unrelated.,B,Autonomy allows patients to choose/refuse care if competent.,,FUND – Ethics,Fundamentals: Ethicsics,Moderate,,GP-F-I1,GP-F-T4
,GP-S4-64,Major sign of pulmonary edema?,Constipation,Incorrect – unrelated.,Leg cramps,Incorrect – nonspecific.,Pink frothy sputum,Correct – classic pulmonary edema sign.,Abdominal swelling,Incorrect – systemic congestion.,C,"Pulmonary edema presents with dyspnea, crackles, frothy sputum.",,MED – Respiratory,Medicine: Respiratory,Hard,,GP-F-I1,GP-F-T4
,GP-S4-65,Nurses are professionally accountable to:,The doctor,"Incorrect – accountability is professional, not hierarchical.",The family,Incorrect – families are not regulators.,Nursing & Midwifery Council,Correct – regulatory body.,Health insurance body,Incorrect – not regulatory.,C,"In Ghana, the NMC regulates licensure, practice, & accountability.",,FUND – Professionalism,Fundamentals: Professionalism,Easy,,GP-F-I1,GP-F-T4
,GP-S4-66,Normal adult respiration rate?,6–10 bpm,Incorrect – too low.,10–15 bpm,"Incorrect – lower end, not full range.",12–20 bpm,Correct – standard adult rate.,24–30 bpm,Incorrect – tachypnea.,C,Adults normally breathe 12–20/min; <12 or >20 needs evaluation.,,FUND – Vital Signs,Fundamentals: Vital Signs,Easy,,GP-F-I1,GP-F-T4
,GP-S4-67,Which is an objective sign?,Pain,Incorrect – subjective.,Blood pressure,Correct – measurable/observable.,Dizziness,Incorrect – subjective.,Nausea,Incorrect – subjective.,B,"Objective = measurable (vitals, labs); subjective = patient-reported.",,FUND – Assessment,Fundamentals: Assessment,Easy,,GP-F-I1,GP-F-T4
,GP-S4-68,How can a nurse promote patient privacy?,Leave doors open,Incorrect – reduces privacy.,Close curtains during care,Correct – maintains dignity/confidentiality.,Discuss openly in hallway,Incorrect – breaches confidentiality.,Share charts with visitors,Incorrect – violates privacy.,B,Curtains/screens & confidentiality protect dignity.,,FUND – Ethics/Patient Rights,Fundamentals: Ethicsics/Patient Rights,Easy,,GP-F-I1,GP-F-T4
,GP-S4-69,Which reduces pressure ulcers?,Hard mattress,Incorrect – increases risk.,Apply talcum powder,Incorrect – doesn’t relieve pressure.,Frequent repositioning,Correct – prevents ischemia/ulcers.,Let patient lie still,Incorrect – worsens risk.,C,"Turning every 2 hrs, skin care, and offloading prevent ulcers.",,FUND – Pressure Injury Prevention,Fundamentals: Pressure Injury Prevention,Moderate,,GP-F-I1,GP-F-T4
,GP-S4-70,Hand hygiene is recommended:,Only before meals,Incorrect – too limited.,After gloves only,Incorrect – not enough.,Before & after all patient contact,Correct – universal standard.,Every 2 hours,Incorrect – based on care moments.,C,"WHO “5 Moments” highlight before/after contact, aseptic tasks, etc.",,FUND – IPC,Fundamentals: IPC,Easy,,GP-F-I1,GP-F-T4
,GP-S4-71,"To assess orientation, nurses check:",Pulse,"Incorrect – vital sign, not orientation.","Person, place, time",Correct – orientation domains.,Blood sugar,Incorrect – lab test.,Gait,"Incorrect – mobility, not orientation.",B,"Orientation is part of mental status exam: person, place, time.",,FUND – Neuro Assessment,Fundamentals: Neuro Assessment,Easy,,GP-F-I1,GP-F-T4
,GP-S4-72,Purpose of gait belt?,Lift patients to bed,Incorrect – unsafe.,Assist in safe ambulation,Correct – prevents falls.,Tie to chairs,"Incorrect – restraint, unethical.",Hygiene help,Incorrect – not purpose.,B,Gait belts stabilize patients during mobility & reduce falls.,,FUND – Mobility & Rehab,Fundamentals: Mobility & Rehab,Moderate,,GP-F-I1,GP-F-T4
,GP-S4-73,Informed consent NOT required for:,Surgery,Incorrect – requires consent.,Checking vital signs,Correct – routine care.,Blood transfusion,Incorrect – requires consent.,Invasive diagnostics,Incorrect – requires consent.,B,"Routine care (vitals, bathing) does not require consent.",,FUND – Ethics/Consent,Fundamentals: Ethicsics/Consent,Easy,,GP-F-I1,GP-F-T4
,GP-S4-74,Goal of diabetic patient education?,Cure diabetes,Incorrect – not curable.,Promote self-management,Correct – empowers control.,Prevent visits,Incorrect – unrealistic.,Increase meds,Incorrect – not goal.,B,"Education improves adherence, diet, & glycemic control.",,MED – Endocrinology,Medicine: Endocrinology,Moderate,,GP-F-I1,GP-F-T4
,GP-S4-75,Who is legally responsible for a nursing task?,Nurse who performs it,Correct – accountability lies with performer.,Doctor,Incorrect – not directly.,Supervisor,Incorrect – oversight only.,Pharmacist,Incorrect – unrelated.,A,Accepting delegation = taking responsibility.,,FUND – Professional Practice,Fundamentals: Professional Practice,Hard,,GP-F-I1,GP-F-T4
,GP-S4-76,A professional boundary is:,Avoiding physical touch,Incorrect – not always.,Clear line between therapeutic & personal relationships,Correct – defines professionalism.,Being friendly always,Incorrect – can cross boundary.,Accepting gifts,Incorrect – may breach ethics.,B,Boundaries protect therapeutic trust & prevent exploitation.,,FUND – Ethics/Boundaries,Fundamentals: Ethicsics/Boundaries,Moderate,,GP-F-I1,GP-F-T4
,GP-S4-77,Fire extinguisher for electrical fires?,Water,"Incorrect – conductive, dangerous.",Foam,Incorrect – not safest.,CO₂,"Correct – safe, non-conductive.",Paper,Incorrect – irrelevant.,C,CO₂ extinguishers are safest for electrical equipment fires.,,FUND – Safety,Fundamentals: Safety,Easy,,GP-F-I1,GP-F-T4
,GP-S4-78,Forgetting to give insulin is called:,Neglect,Incorrect – broader failure of care.,Abuse,Incorrect – intentional harm.,Omission error,Correct – required care not given.,Violation,Incorrect – deliberate deviation.,C,"Omission = failing to act when required, risking harm.",,FUND – Med Errors,Fundamentals: Medicine Errors,Moderate,,GP-F-I1,GP-F-T4
,GP-S4-79,Core value in nursing ethics?,Beauty,Incorrect – irrelevant.,Respect for human dignity,Correct – central value.,Aggression,Incorrect – violates ethics.,Tolerance for misconduct,Incorrect – unsafe.,B,Respect for dignity underpins all nursing codes.,,FUND – Ethics,Fundamentals: Ethicsics,Easy,,GP-F-I1,GP-F-T4
,GP-S4-80,"If client complains about care, nurse should:",Ignore,Incorrect – unsafe.,Argue,Incorrect – unprofessional.,Listen & report,Correct – ensures resolution.,Walk away,Incorrect – dismissive.,C,Active listening & reporting complaints improves care & trust.,,FUND – Communication,Fundamentals: Communication,Moderate,,GP-F-I1,GP-F-T4
,GP-S4-81,Accountability in nursing means:,Delegating only,Incorrect – delegation ≠ accountability.,Full responsibility for actions,Correct – hallmark of accountability.,Avoiding documentation,Incorrect – records are part of accountability.,Blaming others,Incorrect – unethical.,B,Nurses are accountable for every action within their practice scope.,,FUND – Ethics,Fundamentals: Ethicsics,Moderate,,GP-F-I1,GP-F-T4
,GP-S4-82,Patient expresses suicidal thoughts. First response?,Tell friends,Incorrect – breaches confidentiality.,Ignore,Incorrect – unsafe.,Notify mental health professionals urgently,Correct – safety is priority.,Offer sleeping pills,Incorrect – unsafe.,C,Suicidal ideation = psychiatric emergency; immediate referral needed.,,MHN – Crisis Care,Mental Health: Crisis Care,Hard,,GP-F-I1,GP-F-T4
,GP-S4-83,Safest transfer of weak patient?,Use one arm,Incorrect – unsafe.,Use equipment/help,Correct – ensures safety.,Push quickly,Incorrect – unsafe.,Drag patient,Incorrect – unsafe/undignified.,B,Safe transfers protect both nurse & patient.,,FUND – Mobility,Fundamentals: Mobility,Easy,,GP-F-I1,GP-F-T4
,GP-S4-84,Patient short of breath. First action?,Take temp,Incorrect – not priority.,Raise head of bed,Correct – eases breathing.,Give pain meds,Incorrect – unrelated.,Feed patient,Incorrect – unsafe.,B,High Fowler’s position optimizes lung expansion.,,MED – Respiratory,Medicine: Respiratory,Easy,,GP-F-I1,GP-F-T4
,GP-S4-85,First step in nursing procedure?,Explain outcome,Incorrect – comes after prep.,Wash hands & prepare,Correct – infection control first.,Document result,Incorrect – last step.,Call doctor,Incorrect – not procedural.,B,Handwashing prevents cross-infection.,,FUND – IPC,Fundamentals: IPC,Easy,,GP-F-I1,GP-F-T4
,GP-S4-86,Documentation must be:,Fancy,Incorrect – irrelevant.,Done at end shift,Incorrect – must be timely.,"Accurate, timely, factual",Correct – meets legal/professional standards.,In capitals,Incorrect – style irrelevant.,C,Legal/professional documentation must be precise.,,FUND – Documentation,Fundamentals: Documentation,Easy,,GP-F-I1,GP-F-T4
,GP-S4-87,Which is NOT a right of med administration?,Right route,Correct – part of 10 rights.,Right personality,Incorrect – not included.,Right time,Correct – included.,Right dose,Correct – included.,B,“Right personality” is not among the 10 rights.,,FUND – Med Admin,Fundamentals: Medicine Admin,Easy,,GP-F-I1,GP-F-T4
,GP-S4-88,Ethics in nursing based on:,Respect for life/well-being,Correct – foundation of care.,Religious law,"Incorrect – ethics are professional, not religious.",Profit,Incorrect – not ethical.,Fear of punishment,Incorrect – negative motivator.,A,Nursing ethics aim at promoting health & protecting rights.,,FUND – Ethics,Fundamentals: Ethicsics,Moderate,,GP-F-I1,GP-F-T4
,GP-S4-89,PPE in infection control means:,Patient Personal Evidence,Incorrect.,Personal Protective Equipment,"Correct – gloves, masks, gowns.",Patient Privacy Essentials,Incorrect.,Professional Practice Exams,Incorrect.,B,PPE protects staff & patients from exposure.,,FUND – IPC,Fundamentals: IPC,Easy,,GP-F-I1,GP-F-T4
