Column 1,item_id,stem,option_a,fb_a,option_b,fb_b,option_c,fb_c,option_d,fb_d,correct,rationale,rationale_img,subject,topic,difficulty,marks,instant_id,timed_id
,GP-S1-77,The preferred injection site for adults receiving IM injections is:,Abdomen,"Incorrect – used for subcutaneous injections (e.g., insulin).",Deltoid or ventrogluteal,Correct – both are safe and accessible for adults.,Forearm,Incorrect – site for IV access or intradermal injections.,,,B,Deltoid (small volumes) and ventrogluteal (larger volumes) are the preferred IM sites in adults.,,SURG,Surgery,Moderate,,GP-F-I2,GP-F-T1
,GP-S1-78,Which electrolyte imbalance can cause muscle cramps and tetany?,High sodium,"Incorrect – leads to confusion, not tetany.",Low calcium,Correct – increases neuromuscular excitability causing spasms.,High potassium,"Incorrect – causes arrhythmias and weakness, not tetany.",,,B,"Hypocalcemia causes tetany, Chvostek’s and Trousseau’s signs, and neuromuscular irritability.",,MED,Medicine,Hard,,GP-F-I2,GP-F-T1
,GP-S1-79,Which organ removes waste products from the blood?,Liver,Incorrect – detoxifies but kidneys are primary.,Kidneys,"Correct – filter blood, excrete wastes in urine.",Lungs,"Incorrect – excrete CO₂, but not main waste organ.",,,B,"Kidneys maintain fluid, electrolyte, and waste balance through urine formation.",,MED,Medicine,Easy,,GP-F-I2,GP-F-T1
,GP-S1-80,Which is the most effective method of family planning?,Rhythm method,Incorrect – high failure rate.,Implants and IUDs,Correct – long-acting reversible contraceptives (LARCs) are most reliable.,Withdrawal,Incorrect – highly unreliable.,,,B,"LARCs (implants, IUDs) are highly effective, safe, and reversible methods of contraception.",,PHN,Public/community health,Moderate,,GP-F-I2,GP-F-T1
,GP-S1-81,The legal document giving power to someone to make decisions for a patient is:,Consent form,"Incorrect – grants permission for treatment, not decision-making authority.",Power of attorney,Correct – authorizes another to make healthcare/legal decisions.,Death certificate,"Incorrect – records cause of death, unrelated to decision-making.",,,B,A power of attorney gives legal authority to another person to act on behalf of a patient in health or financial matters.,,ETH,Ethics,Moderate,,GP-F-I2,GP-F-T1
,GP-S1-82,"When a patient refuses treatment, the nurse should:",Ignore the patient,Incorrect – neglects autonomy and safety.,Respect the decision and document it,Correct – ensures ethical practice and legal protection.,Force treatment,Incorrect – violates autonomy and professional ethics.,,,B,Respecting autonomy means patients can decline treatment; nurses must document and inform the team.,,ETH,Ethics,Moderate,,GP-F-I2,GP-F-T1
,GP-S1-83,Oral rehydration therapy is primarily used to treat:,Dehydration from diarrhea,Correct – restores fluids and electrolytes lost.,Vomiting,Incorrect – oral fluids may not be tolerated.,Malaria,"Incorrect – requires antimalarial drugs, not ORT.",,,A,"ORT is a simple, lifesaving therapy for diarrhea-related dehydration, especially in children.",,PHN,Public/community health,Easy,,GP-F-I2,GP-F-T1
,GP-S1-84,Symptoms of shock include all EXCEPT:,"Pale, cool skin",Correct – common due to poor perfusion.,High blood pressure,"Incorrect – shock usually causes hypotension, not hypertension.",Rapid pulse,Correct – tachycardia compensates for low BP.,,,B,"Shock presents with hypotension, tachycardia, cold clammy skin, and shallow breathing.",,MED,Medicine,Moderate,,GP-F-I2,GP-F-T1
,GP-S1-85,The drug used to treat severe allergic reactions is:,Paracetamol,"Incorrect – analgesic/antipyretic, not for anaphylaxis.",Adrenaline (epinephrine),Correct – reverses airway obstruction and shock.,Insulin,"Incorrect – used for diabetes, not allergy.",,,B,"Adrenaline is the emergency drug of choice in anaphylaxis, given intramuscularly.",,MED,Medicine,Easy,,GP-F-I2,GP-F-T1
,GP-S1-86,One way to check patient identity before giving meds is:,Ask roommate,Incorrect – unreliable and unsafe.,Check ID band,Correct – safest and recommended method.,Trust patient memory,"Incorrect – prone to error, especially in confused patients.",,,B,Checking the ID band prevents medication errors and ensures right-patient safety.,,FUND,Fundamentals,Easy,,GP-F-I2,GP-F-T1
,GP-S1-87,"In a normal adult, how many teeth are present?",20,Incorrect – represents deciduous (baby) teeth.,32,"Correct – 16 upper, 16 lower permanent teeth.",28,Incorrect – excludes wisdom teeth.,,,B,"Adults normally have 32 permanent teeth, including third molars (wisdom teeth).",,FUND,Fundamentals,Easy,,GP-F-I2,GP-F-T1
,GP-S1-88,A blood glucose level of 3.0 mmol/L is considered:,Normal,Incorrect – normal fasting is 4–7 mmol/L.,Hypoglycemia,Correct – <3.9 mmol/L is hypoglycemia.,Hyperglycemia,Incorrect – >7 mmol/L fasting.,,,B,"Hypoglycemia (<3.9 mmol/L) can cause sweating, tremors, and confusion; prompt glucose is needed.",,MED,Medicine,Moderate,,GP-F-I2,GP-F-T1
,GP-S1-89,"During CPR, the chest should be compressed:",At a rate of 30/min,Incorrect – too slow for effective perfusion.,At a rate of 100–120 per minute,Correct – ensures adequate circulation.,Once every 10 seconds,Incorrect – grossly inadequate.,,,B,CPR guidelines recommend 100–120 compressions per minute at 5–6 cm depth.,,FUND,Fundamentals,Hard,,GP-F-I2,GP-F-T1
,GP-S1-90,A major role of Vitamin C is to:,Build bones,Incorrect – Vitamin D and calcium are key.,Enhance wound healing and immunity,Correct – supports collagen synthesis and immunity.,Reduce cholesterol,Incorrect – not a major Vitamin C role.,,,B,"Vitamin C deficiency causes scurvy, with poor wound healing, gum bleeding, and impaired immunity.",,NUTR,Nutrition,Easy,,GP-F-I2,GP-F-T1
,GP-S1-91,A contraindication to oral medication is:,Vomiting,Correct – drug may be expelled or aspirated.,Hunger,Incorrect – not a contraindication.,Sleep,Incorrect – patient can be awakened.,,,A,Vomiting or impaired swallowing makes oral medication unsafe; alternative routes are needed.,,FUND,Fundamentals,Easy,,GP-F-I2,GP-F-T1
,GP-S1-92,The safest way to dispose of used needles is to:,Throw in dustbin,"Incorrect – unsafe, risk of sharps injury.",Place in sharps container,Correct – puncture-proof disposal protects staff.,Burn openly,"Incorrect – hazardous, not safe practice.",,,B,Sharps containers prevent needle-stick injuries and infection transmission.,,FUND,Fundamentals,Easy,,GP-F-I2,GP-F-T1
,GP-S1-93,Constipation is defined as:,Diarrhea,Incorrect – opposite of constipation.,"Infrequent, hard stool passage",Correct – hallmark of constipation.,Increased urination,"Incorrect – unrelated, describes polyuria.",,,B,"Constipation involves reduced bowel frequency with hard stools, often due to poor diet, immobility, or medication.",,MED,Medicine,Easy,,GP-F-I2,GP-F-T1
,GP-S1-94,What is the function of platelets?,Oxygen transport,Incorrect – RBCs carry oxygen.,Blood clotting,Correct – platelets form plugs and activate clotting cascade.,Fight infection,Incorrect – WBCs provide immune defense.,,,B,Platelets prevent excessive bleeding by forming clots and initiating coagulation pathways.,,MED,Medicine,Easy,,GP-F-I2,GP-F-T1
,GP-S1-95,The major site of nutrient absorption is:,Large intestine,Incorrect – mainly absorbs water/electrolytes.,Small intestine,Correct – absorbs most nutrients.,Stomach,"Incorrect – mainly digests proteins, little absorption.",,,B,"Small intestine villi and microvilli maximize surface area for absorption of carbohydrates, proteins, fats, vitamins, and minerals.",,MED,Medicine,Easy,,GP-F-I2,GP-F-T1
,GP-S1-96,A pulse oximeter is used to measure:,Heart rate,Incorrect – measured by ECG/pulse.,Oxygen saturation,Correct – % of hemoglobin bound with oxygen.,Respiratory rate,Incorrect – must be counted manually.,,,B,"Pulse oximetry non-invasively measures SpO₂, indicating oxygenation status.",,MED,Medicine,Easy,,GP-F-I2,GP-F-T1
,GP-S1-97,Which food is richest in protein?,Yam,Incorrect – mainly carbohydrate.,Eggs,Correct – high-quality complete protein.,Rice,Incorrect – contains incomplete protein.,,,B,"Eggs provide essential amino acids for growth, repair, and immune function.",,NUTR,Nutrition,Easy,,GP-F-I2,GP-F-T1
,GP-S1-98,"The term ""bradycardia"" means:",Fast heart rate,Incorrect – that is tachycardia.,Slow heart rate,Correct – <60 bpm in adults.,Irregular heart rhythm,Incorrect – refers to arrhythmia.,,,B,"Bradycardia is a slow HR, normal in athletes but pathological if symptomatic.",,MED,Medicine,Moderate,,GP-F-I2,GP-F-T1
,GP-S1-99,What is the normal fasting blood glucose level?,9.0–11.0 mmol/L,Incorrect – hyperglycemia.,4.0–7.0 mmol/L,Correct – normal range for adults.,1.0–2.0 mmol/L,Incorrect – dangerously hypoglycemic.,,,B,Normal fasting glucose is 4–7 mmol/L; higher indicates impaired regulation or diabetes.,,MED,Medicine,Moderate,,GP-F-I2,GP-F-T1
,GP-S1-100,"Before surgery, why should a patient fast?",To prevent tiredness,Incorrect – not related.,To reduce risk of aspiration,Correct – empty stomach prevents regurgitation and inhalation.,To lower temperature,Incorrect – fasting does not affect body temperature.,,,B,"Pre-op fasting reduces aspiration risk under anesthesia, a critical safety measure.",,SURG,Surgery,Moderate,,GP-F-I2,GP-F-T1
,,,,,,,,,,,,,,,,,,,
,,,,,,,,,,,,,,,,,,,
,,,,,,,,,,,,,,,,,,,
,,,,,,,,,,,,,,,,,,,
,GP-S2-1,"A nurse prepares to dress a wound and dons gloves, mask, and gown. What is the main purpose of this personal protective equipment (PPE)?",To protect the patient only,Incorrect – infection control protects both patient and healthcare worker.,To protect both nurse and patient from infection,Correct – PPE breaks the chain of infection in both directions.,To make procedures faster,Incorrect – PPE may slow procedure but ensures safety.,,,B,"PPE prevents pathogen transfer, safeguarding both patients and staff, especially in invasive or high-risk procedures.",,FUND,Fundamentals,Easy,,GP-F-I4,GP-F-T2
,GP-S2-2,Which of these is NOT considered a routine vital sign?,Blood pressure,Incorrect – measured regularly in all patients.,Blood glucose,"Correct – checked only when clinically indicated (e.g., diabetes).",Temperature,Incorrect – part of the core vital signs.,,,B,"Vital signs include temperature, pulse, respiration, and blood pressure. Blood glucose is important but not universally routine.",,FUND,Fundamentals,Easy,,GP-F-I4,GP-F-T2
,GP-S2-3,An adult patient’s pulse oximeter reading shows 97%. How should the nurse interpret this value?,Hypoxemia,Incorrect – suggests significant oxygen deficit.,Normal oxygen saturation,Correct – healthy adult SpO₂ is within this range., Physiologically impossible,Incorrect – saturation cannot exceed 97%,,,B,SpO₂ of 95–100% indicates adequate oxygenation. Persistent readings <94% may signal respiratory compromise.,,MED,Medicine,Easy,,GP-F-I4,GP-F-T2
,GP-S2-4,A 40-year-old man with head trauma shows unsteady gait and poor coordination. Which part of the brain is most likely affected?,Cerebrum,"Incorrect – higher thinking and voluntary control, not balance.",Cerebellum,"Correct – coordinates movement, posture, and balance.",Hypothalamus,Incorrect – controls autonomic and endocrine functions.,,,B,"The cerebellum integrates sensory input and motor activity, maintaining equilibrium and coordination.",,FUND,Fundamentals,Moderate,,GP-F-I4,GP-F-T2
,GP-S2-5,A patient with anemia presents to the outpatient clinic. Which clinical sign would the nurse most expect?,Pallor,Correct – reduced hemoglobin causes pale skin and mucosa.,Jaundice,Incorrect – indicates bilirubin accumulation from liver disease.,Cyanosis,"Incorrect – reflects oxygen desaturation, not anemia.",,,A,Pallor is a common sign of anemia due to decreased red cell mass and oxygen-carrying capacity.,,MED,Medicine,Easy,,GP-F-I4,GP-F-T2
,GP-S2-6,Which organ is responsible for producing insulin?,Pancreas,Correct – beta cells in the islets of Langerhans secrete insulin.,Kidney,"Incorrect – involved in filtration and excretion, not hormone production.",Liver,Incorrect – stores glycogen and metabolizes insulin but does not produce it.,,,A,Insulin regulates blood glucose by facilitating cellular uptake; deficiency causes diabetes mellitus.,,MED,Medicine,Easy,,GP-F-I4,GP-F-T2
,GP-S2-7,A nurse reviews a patient’s lab results showing elevated white blood cells. What are their main function?,Transport oxygen,Incorrect – performed by red blood cells.,Fight infection,Correct – WBCs defend against pathogens.,Assist in clotting,"Incorrect – platelets aid hemostasis, not WBCs.",,,B,White blood cells protect the body via immune responses including phagocytosis and antibody production.,,MED,Medicine,Easy,,GP-F-I4,GP-F-T2
,GP-S2-8,At what angle should an intramuscular (IM) injection be administered?,90 degrees,Correct – ensures medication reaches deep muscle.,45 degrees,Incorrect – typical for subcutaneous injections.,15 degrees,Incorrect – used for intradermal injections.,,,A,IM injections at 90° penetrate muscle tissue effectively for absorption.,,FUND,Fundamentals,Easy,,GP-F-I4,GP-F-T2
,GP-S2-9,A malnourished child presents with bleeding gums and poor wound healing. Which vitamin deficiency is most likely?,Vitamin C (Scurvy),Correct – causes impaired collagen synthesis.,Vitamin D (Rickets),Incorrect – leads to bone deformities.,Vitamin B1 (Beriberi),Incorrect – causes neuropathy and heart failure.,,,A,"Vitamin C deficiency leads to scurvy, presenting with bleeding gums, poor healing, and bruising.",,NUTR,Nutrition,Moderate,,GP-F-I4,GP-F-T2
,GP-S2-10,An outbreak of yellow fever is reported in a Ghanaian community. Which vector transmits this disease?,Aedes mosquito,Correct – primary vector for yellow fever.,Tsetse fly,Incorrect – transmits trypanosomiasis (sleeping sickness).,Housefly,"Incorrect – mechanical spread of diarrheal diseases, not yellow fever.",,,A,"Yellow fever is transmitted by Aedes aegypti, preventable through vaccination and vector control.",,PHN,Public/community health,Moderate,,GP-F-I4,GP-F-T2
,GP-S2-11,A patient reports difficulty swallowing. What is the correct medical term for this condition?,Dysphagia,Correct – difficulty swallowing.,Dyspnea,Incorrect – difficulty breathing.,Dysuria,Incorrect – painful urination.,,,A,"Dysphagia may result from neurological disorders, obstruction, or muscular dysfunction.",,FUND,Fundamentals,Easy,,GP-F-I4,GP-F-T2
,GP-S2-12,Which body system is primarily affected in asthma?,Respiratory system,Correct – airway inflammation and bronchospasm.,Cardiovascular system,"Incorrect – may show secondary effects, but not primary.",Digestive system,Incorrect – unrelated to asthma pathophysiology.,,,A,"Asthma involves reversible airway narrowing, causing wheezing, coughing, and breathlessness.",,MED,Medicine,Easy,,GP-F-I4,GP-F-T2
,GP-S2-13,A patient’s respiratory rate is recorded as 30 breaths per minute. This condition is termed:,Tachypnea,Correct – abnormally rapid breathing.,Apnea,Incorrect – absence of breathing.,Bradypnea,Incorrect – abnormally slow breathing.,,,A,"Tachypnea is rapid respiration often seen in fever, hypoxia, or anxiety.",,FUND,Fundamentals,Easy,,GP-F-I4,GP-F-T2
,GP-S2-14,Which of the following does NOT sterilize equipment?,Autoclaving,Incorrect – high-pressure steam sterilizes effectively.,Freezing,Correct – preserves microorganisms but does not kill them.,Boiling,Incorrect – kills most pathogens though less effective than autoclaving.,,,B,Sterilization destroys all microbes; freezing only slows their activity without killing them.,,FUND,Fundamentals,Moderate,,GP-F-I4,GP-F-T2
,GP-S2-15,Which organ is the body’s main site for detoxifying drugs and toxins?,Liver,Correct – metabolizes drugs via enzymatic processes.,Kidney,Incorrect – primarily excretes but does not metabolize toxins.,Lungs,Incorrect – expel gases but not systemic detox.,,,A,The liver detoxifies substances through biotransformation before excretion.,,MED,Medicine,Easy,,GP-F-I4,GP-F-T2
,GP-S2-16,A community nurse screens clients for obesity. The acronym BMI stands for:,Body Mass Index,Correct – weight in relation to height.,Blood Measurement Indicator,Incorrect – not a clinical term.,Body Muscle Index,Incorrect – not recognized in clinical practice.,,,A,"BMI is a quick screening tool for nutritional status, not a direct measure of body fat.",,PHN,Public/community health,Easy,,GP-F-I4,GP-F-T2
,GP-S2-17,A 60-year-old patient’s pulse is recorded at 52 beats per minute. What is this condition called?,Bradycardia,Correct – slow heart rate <60 bpm.,Tachycardia,Incorrect – fast heart rate >100 bpm.,Arrhythmia,"Incorrect – irregular rhythm, not necessarily slow.",,,A,"Bradycardia can be physiological (athletes) or pathological (heart block, medication effects).",,MED,Medicine,Easy,,GP-F-I4,GP-F-T2
,GP-S2-18,The average normal adult body temperature is:,36.5–37.5 °C,Correct – normal thermoregulation range.,35.0–36.0 °C,Incorrect – indicates hypothermia.,38.0–39.0 °C,Incorrect – indicates fever.,,,A,Average body temperature is 36.5–37.5 °C; persistent deviations indicate illness.,,FUND,Fundamentals,Easy,,GP-F-I4,GP-F-T2
,GP-S2-19,A nurse records a patient’s BP as 170/100 mmHg. How should this finding be described?,Hypertension,Correct – sustained high blood pressure.,Hypotension,Incorrect – low blood pressure.,Normal blood pressure,Incorrect – standard range ~120/80 mmHg.,,,A,"Hypertension is defined as persistently elevated BP ≥140/90 mmHg, a major risk factor for cardiovascular disease.",,MED,Medicine,Easy,,GP-F-I4,GP-F-T2
,GP-S2-20,A patient with right-sided heart failure presents with distended neck veins. What does this finding indicate?,Heart failure,Correct – venous congestion from impaired right heart function.,Dehydration,"Incorrect – causes flat, not distended, neck veins.",Anemia,"Incorrect – causes pallor and fatigue, not JVD.",,,A,"Jugular vein distension reflects increased central venous pressure, typically from right-sided heart failure.",,MED,Medicine,Moderate,,GP-F-I4,GP-F-T2
,GP-S2-21,Which measure most effectively breaks the chain of infection at the “mode of transmission” link?,Timely antibiotic therapy,"Incorrect – acts on the pathogen, not the transmission pathway.",Hand hygiene before and after patient contact,Correct – interrupts transfer of microorganisms between patients and surfaces.,Vaccination of healthcare workers,"Incorrect – prevents susceptibility, but not daily transmission.",,,B,Transmission usually occurs via contaminated hands. Proper handwashing or alcohol rubs before and after patient contact directly breaks this link.,,FUND,Fundamentals,Moderate,,GP-F-I4,GP-F-T2
,GP-S2-22,"A patient with persistent cough, night sweats, and weight loss is admitted. What is the nurse’s immediate action to reduce exposure risk?",Place in airborne isolation with respirator use (N95/FFP2),Correct – TB requires strict airborne precautions.,Start broad-spectrum antibiotics,Incorrect – requires medical prescription and doesn’t prevent spread.,Encourage deep breathing exercises at bedside,Incorrect – can increase aerosol spread without precautions.,,,A,Suspected pulmonary TB must be isolated in a negative-pressure room with appropriate respirator use to prevent airborne transmission.,,MED,Medicine,Moderate,,GP-F-I4,GP-F-T2
,GP-S2-23,"During triage, which patient should be prioritized first?",Asthma patient talking in full sentences with SpO₂ 95%,"Incorrect – currently stable, not immediately life-threatening.",Trauma patient with uncontrolled external bleeding,Correct – uncontrolled hemorrhage is an immediate threat to life.,Elderly patient with BP 160/90 and mild headache,Incorrect – elevated BP is urgent but not immediately life-threatening.,,,B,The ABC principle prioritizes circulation compromise. Uncontrolled bleeding can cause rapid death if not addressed first.,,FUND,Fundamentals,Moderate,,GP-F-I4,GP-F-T2
,GP-S2-24,"A postoperative client reports a sudden “pop” at the abdominal incision, and bowel loops are visible. What is the nurse’s first action?",Reinsert the organs with sterile gloves,Incorrect – never attempt to push viscera back.,"Cover with sterile, saline-moistened dressings and call surgeon",Correct – protects tissues until surgical intervention.,Sit the client upright,Incorrect – increases intra-abdominal pressure and worsens evisceration.,,,B,Abdominal evisceration is a surgical emergency. The nurse must keep tissues moist and protected while awaiting urgent surgical repair.,,SURG,Surgery,Hard,,GP-F-I4,GP-F-T2
,GP-S2-25,Which documentation entry best reflects accurate nursing practice?,“Patient difficult and non-compliant.”,"Incorrect – judgmental, lacks objectivity.","“Patient states, ‘I feel dizzy.’ BP 88/56 mmHg; assisted to bed; IV fluids commenced as prescribed.”","Correct – objective, complete, and includes interventions.",“Seems unwell; probably dehydrated.”,Incorrect – vague and speculative.,,,B,"Good documentation is factual, precise, and includes both subjective and objective data plus nursing actions.",,FUND,Fundamentals,Moderate,,GP-F-I4,GP-F-T2
,GP-S2-26,A client with diabetic ketoacidosis (DKA) most likely presents with:,Bradycardia and constricted pupils,Incorrect – suggests opioid toxicity.,Hyperventilation with fruity breath and dehydration,Correct – classic features of metabolic acidosis with ketone buildup.,Sudden unilateral weakness and facial droop,"Incorrect – suggests stroke, not DKA.",,,B,"DKA is characterized by Kussmaul respirations, acetone breath, dehydration, and altered mental state due to hyperglycemia.",,MED,Medicine,Moderate,,GP-F-I4,GP-F-T2
,GP-S2-27,The safest intramuscular injection site in infants under 12 months is:,Deltoid,Incorrect – muscle mass insufficient.,Vastus lateralis (anterolateral thigh),Correct – well developed and avoids major nerves/vessels.,Dorsogluteal,Incorrect – high risk of sciatic nerve injury.,,,B,The vastus lateralis is the recommended site for IM injections in infants due to safety and adequate muscle development.,,PEDS,Paediatrics,Easy,,GP-F-I4,GP-F-T2
,GP-S2-28,Which bedside finding is the earliest sensitive indicator of postpartum hemorrhage (PPH)?,Falling hemoglobin on next-day labs,Incorrect – lab changes appear late.,Increasing pulse and pallor with heavy lochia/clots,Correct – clinical signs precede lab results.,Elevated blood pressure,Incorrect – BP often remains stable until severe blood loss.,,,B,"Early recognition of PPH depends on observing tachycardia, pallor, and excessive bleeding before hypotension develops.",,MID,Midwifery,Moderate,,GP-F-I4,GP-F-T2
,GP-S2-29,Which wound is best classified as “clean-contaminated”?,Elective colon surgery with controlled bowel entry,Correct – involves entry into a hollow viscus without gross contamination.,Sterile hernia repair with no viscera entry,Incorrect – classified as clean.,Traumatic laceration in a muddy field,Incorrect – classified as contaminated/dirty.,,,A,"Wound classification depends on surgical site and contamination risk. Clean-contaminated wounds involve controlled entry into the GI, GU, or respiratory tract.",,SURG,Surgery,Hard,,GP-F-I4,GP-F-T2
,GP-S2-30,A COPD patient has chronic CO₂ retention. What should the nurse expect?,Reliance on hypoxic drive; titrate oxygen to 88–92%,Correct – excessive oxygen can worsen CO₂ retention.,High-flow oxygen to reach 100% saturation,Incorrect – may cause CO₂ narcosis.,Avoid oxygen entirely,Incorrect – risks worsening hypoxemia.,,,A,Controlled O₂ therapy prevents hypoxemia while avoiding hypercapnia in CO₂ retainers.,,MED,Medicine,Hard,,GP-F-I4,GP-F-T2
,GP-S2-31,"A nurse is caring for a client in active labor whose membranes have just ruptured. Upon examination, the nurse notes a prolapsed umbilical cord. What is the nurse's immediate priority action?",Place mother in knee-chest or Trendelenburg and relieve cord pressure manually,Correct – reduces compression until delivery.,Encourage bearing down to speed delivery,Incorrect – increases cord compression.,Apply fundal pressure,Incorrect – worsens fetal compromise.,,,A,"Manual elevation with a sterile gloved hand directly relieves pressure on the prolapsed cord, preventing compression of umbilical vessels and restoring blood flow to the fetus, which is critical to avoid immediate hypoxia and bradycardia in this obstetric emergency. Relieving pressure and urgent delivery are life-saving.",,MID,Midwifery,Hard,,GP-F-I4,GP-F-T2
,GP-S2-32,Which nurse–patient interaction demonstrates therapeutic communication with an anxious client?,“Calm down; there’s nothing to worry about.”,Incorrect – dismisses feelings.,“Tell me more about what you’re feeling right now.”,Correct – encourages expression and builds trust.,"“If you’d followed instructions, you wouldn’t be here.”",Incorrect – judgmental and unhelpful.,,,B,"Therapeutic communication validates feelings, encourages dialogue, and supports patient coping.",,MHN,Mental Health,Easy,,GP-F-I4,GP-F-T2
,GP-S2-33,Which vaccine requires strict cold chain storage at +2 to +8 °C?,Measles-rubella vaccine,Correct – requires refrigeration to maintain potency.,Oral rehydration salts,Incorrect – stable at room temperature.,Zinc tablets,Incorrect – also stable at room temperature.,,,A,"Most EPI vaccines, including measles, require cold chain preservation to remain effective.",,PHN,Public/community health,Moderate,,GP-F-I4,GP-F-T2
