Column 1,item_id,stem,option_a,fb_a,option_b,fb_b,option_c,fb_c,option_d,fb_d,correct,rationale,rationale_img,subject,topic,difficulty,marks,instant_id,timed_id
,GP-S3-41,Which of these is a sign of depression?,Excess energy,Incorrect – more typical of mania/hyperactivity.,Persistent sadness and loss of interest,Correct – hallmark symptoms of major depressive disorder.,Visual hallucinations,"Incorrect – psychotic symptom, not core depression.",,,B,"Depression is characterized by low mood, anhedonia, and impaired function; not primarily psychotic or energized states.",,MHN,Mental Health,Easy,,GP-F-I5,GP-F-T3
,GP-S3-42,Which of the following is an airborne disease?,Measles,Correct – highly contagious via airborne droplets.,Typhoid,Incorrect – spread by contaminated food/water.,Gonorrhea,"Incorrect – transmitted sexually, not airborne.",,,A,Airborne diseases like measles require airborne precautions; typhoid and gonorrhea spread differently.,,PHN – Infectious Diseases,Public/community health: Infectious Diseases,Easy,,GP-F-I5,GP-F-T3
,GP-S3-43,Best site for checking pulse during CPR?,Brachial,"Incorrect – used in infants, not adults.",Carotid,Correct – reliable central pulse in adults during low perfusion.,Radial,Incorrect – often absent during cardiac arrest.,,,B,"Central pulses (carotid in adults, brachial in infants) are preferred in resuscitation due to reliability.",,FUND – BLS,Fundamentals: BLS,Easy,,GP-F-I5,GP-F-T3
,GP-S3-44,A patient with difficulty swallowing is said to have:,Dysphasia,"Incorrect – difficulty with language, not swallowing.",Dysphagia,Correct – impaired swallowing.,Aphasia,Incorrect – inability to speak.,,,B,Dysphagia = swallowing difficulty; distinct from speech/language disorders.,,MED,Medicine,Easy,,GP-F-I5,GP-F-T3
,GP-S3-45,Which type of bed is prepared for a post-operative patient?,Recovery bed,Correct – arranged to safely receive a patient post-surgery.,Cardiac bed,Incorrect – designed for cardiac patients (upright).,Open bed,Incorrect – used for admission of mobile patients.,,,A,"A recovery bed has protective features (flat, equipment-ready) to receive unconscious or weak post-op patients.",,FUND – Ward Management,Fundamentals: Ward Management,Moderate,,GP-F-I5,GP-F-T3
,GP-S3-46,One major complication of prolonged immobility is:,Constipation,Incorrect – common but less life-threatening.,Deep vein thrombosis (DVT),Correct – immobility increases venous stasis and clot formation.,Insomnia,Incorrect – may occur but not the most serious complication.,,,B,"Immobility predisposes to VTE, pneumonia, contractures, and pressure sores; DVT is a serious preventable risk.",,FUND – Mobility,Fundamentals: Mobility,Moderate,,GP-F-I5,GP-F-T3
,GP-S3-47,"When documenting care, nurses must:",Use capital letters,"Incorrect – not required, may hinder readability.",Record facts accurately and promptly,"Correct – documentation must be timely, factual, clear.",Use only abbreviations,Incorrect – abbreviations can cause errors.,,,B,"Good documentation is accurate, objective, complete, and contemporaneous; it is a legal and professional duty.",,FUND – Documentation,Fundamentals: Documentation,Easy,,GP-F-I5,GP-F-T3
,GP-S3-48,Best time for breast self-examination?,During menstruation,Incorrect – breasts tender and engorged.,A week after menstruation ends,Correct – hormonal stability allows easier detection of lumps.,During ovulation,Incorrect – still hormonally active period.,,,B,BSE is most effective post-menses when breast tissue is less nodular and less tender.,,PHN – Health Education,Public/community health: Health Education,Easy,,GP-F-I5,GP-F-T3
,GP-S3-49,Function of alveoli is:,Gas exchange,Correct – site for O₂/CO₂ diffusion between lungs and blood.,Blood filtration,"Incorrect – renal function, not respiratory.",Mucus production,"Incorrect – goblet cells produce mucus, not alveoli.",,,A,Alveoli provide large surface area for efficient respiratory gas exchange.,,FUND – Anatomy/Physiology,Fundamentals: Anatomy/Physiology,Easy,,GP-F-I5,GP-F-T3
,GP-S3-50,Most accurate way to verify NG tube placement?,Air insufflation,"Incorrect – unreliable, outdated, unsafe.",pH testing of aspirate,Correct – gastric aspirate pH ≤5.5 suggests stomach placement; x-ray is gold standard.,Patient report,Incorrect – unreliable and unsafe.,,,B,"Objective methods (pH, x-ray) are essential; air “whoosh” is no longer recommended due to aspiration risks.",,FUND – Procedures,Fundamentals: Procedures,Hard,,GP-F-I5,GP-F-T3
,GP-S3-51,Appropriate first response to a patient expressing suicidal intent with a plan?,Promise confidentiality,Incorrect – unsafe; safety overrides secrecy.,"Ensure immediate safety, stay with patient, and notify team",Correct – suicide risk requires urgent intervention.,Advise journaling and discharge,Incorrect – unsafe and inadequate.,,,B,Suicidal intent with a plan is a psychiatric emergency; immediate safety and professional review are priorities.,,MHN – Crisis Intervention,Mental Health: Crisis Intervention,Hard,,GP-F-I5,GP-F-T3
,GP-S3-52,Which action best reduces surgical site infection risk before incision?,Shaving hair with razor the night before,Incorrect – increases infection risk due to micro-abrasions.,Clipping hair immediately before surgery + antisepsis,Correct – reduces skin contamination.,Leaving hair long,Incorrect – no role in infection prevention.,,,B,"SSI prevention relies on clippers instead of razors, antiseptic prep, and timely prophylaxis.",,SURG – Infection Prevention,Surgery: Infection Prevention,Moderate,,GP-F-I5,GP-F-T3
,GP-S3-53,Best site for pulse check during adult cardiac arrest?,Radial artery,Incorrect – often absent in low perfusion states.,Carotid artery,Correct – central pulse reliable in adults.,Dorsalis pedis,Incorrect – peripheral and unreliable in arrest.,,,B,Carotid is recommended in adults; brachial in infants. Radial/dorsalis are unreliable in cardiac arrest.,,FUND – BLS,Fundamentals: BLS,Easy,,GP-F-I5,GP-F-T3
,GP-S3-54,Pneumonia patient develops pleuritic pain + tachypnea. Which sign suggests hypoxemia?,"Warm, dry skin",Incorrect – not hypoxia specific.,Confusion and restlessness,Correct – early cerebral signs of low oxygen delivery.,Polyuria,Incorrect – unrelated to oxygenation.,,,B,Brain is highly oxygen-sensitive; altered mentation is an early red flag of hypoxemia.,,MED – Respiratory,Medicine: Respiratory,Moderate,,GP-F-I5,GP-F-T3
,GP-S3-55,Which maternal labor position is most effective for relieving back pain associated with a fetus in the occiput-posterior position?,Supine lithotomy,Incorrect- This position increases sacral pressure and can intensify back pain.,Hands-and-knees (all-fours),Correct- This position uses gravity to reduce pressure on the maternal spine and encourages the fetus to rotate into a more optimal position.,High Fowler’s,Incorrect- This position is not specifically recommended for managing the back pain associated with an occiput-posterior presentation.,,,B,"For patients experiencing ""back labor"" due to an occiput-posterior fetal position, the hands-and-knees position is highly beneficial. It helps to tilt the pelvis, reducing the direct pressure of the fetal head on the sacrum, and can encourage the baby to rotate anteriorly, thereby alleviating the source of the pain.",,MID – Intrapartum Care,Midwifery: Intrapartum Care,Moderate,,GP-F-I5,GP-F-T3
,GP-S3-56,What is the most appropriate de-escalation approach for an agitated psychotic patient?,Confront the patient's delusions directly,Incorrect- Confronting a patient's delusions can increase their agitation and is likely to escalate the situation.,"Maintain safe distance, use a calm voice, set clear limits, and offer choices",Correct- This strategy prioritizes safety for everyone and uses therapeutic communication to lower agitation and help the patient regain control.,Block the patient's exit and demand compliance,Incorrect- Blocking an exit and demanding compliance can be perceived as threatening and will likely escalate the patient's distress and aggression.,,,B,"A safe and calm environment, combined with non-threatening communication, is the foundation of de-escalation for agitated patients. This approach validates their feelings without validating their delusions, while setting clear boundaries and providing some sense of control through choices. This reduces the risk of harm and promotes a more therapeutic outcome.",,MHN – Behavioural Management,Mental Health: Behavioural Management,Moderate,,GP-F-I5,GP-F-T3
,GP-S3-57,Which patient statement indicates effective teaching regarding oral iron therapy?,"""I will take my iron supplement with a cup of black tea to help with stomach upset.""","Incorrect- Tannins in tea significantly inhibit iron absorption, reducing the medication's effectiveness.","""I will take my iron supplement with orange juice to improve its absorption.""","Correct- Vitamin C (ascorbic acid) enhances the absorption of iron, making this an effective strategy.","""I will stop taking the medication if my stools turn dark.""",Incorrect- Dark or black stools are a common and expected side effect of iron therapy and do not indicate a problem.,,,B,"Effective patient teaching for oral iron therapy emphasizes optimizing absorption and managing side effects. Taking iron with a source of vitamin C (like orange juice) and avoiding inhibitors (like tea or milk) are key for maximizing the therapeutic effect. It is also important to educate patients about normal side effects, such as dark stools, to prevent unnecessary discontinuation of the medication.",,MED – Hematology/Nutrition,Medicine: Hematology/Nutritionition,Easy,,GP-F-I5,GP-F-T3
,GP-S3-58,"During a measles outbreak in a community, what is the most effective immediate measure?",Conducting a mass measles vaccination campaign for contacts and susceptible individuals,"Correct- Rapid, widespread vaccination is the most effective way to interrupt transmission and raise herd immunity levels during an outbreak.",Implementing routine health talks in the community only,Incorrect- Health talks alone are not a sufficient or rapid enough response to control a highly contagious viral outbreak like measles.,Distributing antibiotics to the affected population,"Incorrect- Measles is a viral infection, and antibiotics are ineffective against viruses.",,,A,"Measles is highly contagious and vaccination is the primary preventive measure. During an outbreak, the most immediate and effective community-level response is a targeted vaccination campaign to quickly increase immunity among susceptible populations, thereby containing the spread and protecting the most vulnerable.",,PHN – Outbreak Response,Public/community health: Outbreak Response,Moderate,,GP-F-I5,GP-F-T3
,GP-S3-59,"A nurse observes a patient's surgical incision on postoperative day 2 and notes increasing pain, erythema, and purulent drainage. Which condition is the likely cause?",Normal postoperative healing process,"Incorrect- The presence of purulent drainage is a clear sign of infection, not a normal part of the healing process.",Surgical site infection,"Correct- The combination of increasing pain, redness (erythema), and purulent drainage is the classic presentation of a surgical site infection.",Wound dehiscence,"Incorrect- Dehiscence is the separation of wound edges; it does not, by itself, explain the signs of infection like purulent drainage and erythema.",,,B,"Surgical site infections (SSI) are common postoperative complications. Recognizing the signs—particularly increasing pain, erythema, and the presence of pus—is crucial for early intervention. Unlike normal wound inflammation, these findings indicate a bacterial infection that requires immediate medical attention, often involving antibiotics and wound care.",,SURG – Post-op Care,Surgery: Post-op Care,Moderate,,GP-F-I5,GP-F-T3
,GP-S3-60,"During oxygen therapy via nasal cannula, what is the most appropriate nursing intervention to prevent mucosal dryness?",Increase the oxygen flow rate to achieve 100% oxygen saturation,Incorrect- Increasing flow rates can exacerbate dryness and is potentially harmful in conditions like COPD.,Humidify the oxygen at flow rates greater than 4 L/min and assess mucous membranes regularly,"Correct- Oxygen, especially at higher flow rates, is dry and can irritate mucous membranes. Humidification and regular assessment prevent discomfort and potential complications like nosebleeds.",Intermittently switch the patient to room air,Incorrect- Switching to room air intermittently can cause hypoxemia (low oxygen levels in the blood) and does not prevent mucosal drying.,,,B,"Oxygen administered by nasal cannula is typically dry, and higher flow rates increase the risk of mucosal irritation and dryness. Humidification adds moisture to the oxygen, preventing discomfort and complications. Regular assessment of the patient's mucous membranes ensures the intervention is effective and adjusted as needed.",,MED – Resp Support,Medicine: Resp Support,Moderate,,GP-F-I5,GP-F-T3
,GP-S3-61,What is the typical incubation period for malaria after an infected mosquito bite?,2–4 hours,"Incorrect- The incubation period for malaria is significantly longer, as the parasite needs to complete part of its life cycle in the liver.",7–30 days,"Correct- The incubation period for malaria generally ranges from 7 to 30 days, though this can vary depending on the specific Plasmodium species involved.",1–2 months,"Incorrect- While some forms of malaria, particularly P. vivax and P. ovale, can have a dormant liver stage leading to relapses months or even years later, this is not the typical incubation period for initial symptom onset.",,,B,"The incubation period for malaria varies based on the Plasmodium species. For example, P. falciparum typically has an incubation period of 7–14 days, while P. malariae is longer at 18–40 days. A general range of 7 to 30 days covers the most common presentations.",,PHN – Infectious Diseases,Public/community health: Infectious Diseases,Moderate,,GP-F-I5,GP-F-T3
,GP-S3-62,In which clinical scenario is it mandatory for a nurse to employ aseptic technique?,Performing routine bed making for a patient,"Incorrect- This procedure requires clean, not aseptic, technique as it does not involve a sterile site.",Inserting a urinary catheter,"Correct- This is an invasive procedure that bypasses the body's natural defenses, requiring strict aseptic precautions to prevent infection.",Assisting a patient with feeding,"Incorrect- Standard hygiene is sufficient for this non-invasive task, as it poses no risk to a sterile body site.",,,B,"Aseptic technique is essential for any procedure that involves a break in the patient's skin or mucous membranes. It is crucial for preventing healthcare-associated infections during invasive procedures like catheterization, IV insertion, and wound care by maintaining a sterile environment.",,FUND – Infection Prevention,Fundamentals: Infection Prevention,Easy,,GP-F-I5,GP-F-T3
,GP-S3-63,What is the primary physiological function of leukocytes?,Oxygen transport,"Incorrect- Oxygen transport is the main function of red blood cells, which contain hemoglobin.",Fighting infection,"Correct- Leukocytes, or white blood cells, are integral components of the immune system and are primarily responsible for defending the body against pathogens.",Blood clotting,"Incorrect- Blood clotting is a function of platelets, or thrombocytes.",,,B,"The primary role of white blood cells is to serve as the body's defense mechanism against invading pathogens and foreign substances. They do this through various mechanisms, including phagocytosis (engulfing pathogens), antibody production, and mediating inflammatory responses.",,MED – Hematology,Medicine: Hematology,Easy,,GP-F-I5,GP-F-T3
,GP-S3-64,Which of the following is a psychological need within Maslow's hierarchy of needs?,Oxygen,"Incorrect- Oxygen is a physiological need, which is at the most basic level of the hierarchy.",Self-esteem,"Correct- Self-esteem is a psychological need that relates to feeling respected, competent, and valued, and is found in the higher tiers of the hierarchy.",Food,"Incorrect- Food is a physiological need, essential for immediate survival.",,,B,"Maslow's hierarchy distinguishes between basic physiological needs (like food and oxygen) and higher-level psychological needs (such as belonging, esteem, and self-actualization). Psychological needs become motivating after the more fundamental physiological and safety needs have been sufficiently met.",,FUND – Theories,Fundamentals: Theories,Moderate,,GP-F-I5,GP-F-T3
,GP-S3-65,What does a diuretic medication do?,Increase appetite,Incorrect- A diuretic's primary action is not related to appetite.,Increase urine output,Correct- Diuretics increase urine production to help the body get rid of excess fluid and salt.,Decrease heart rate,"Incorrect- This is the function of other medications, such as beta-blockers.",,,B,"Diuretics, also known as water pills, are used to treat conditions like high blood pressure and fluid retention by increasing urine output.",,PHARM – Cardiovascular,PHARM: Cardiovascular,Easy,,GP-F-I5,GP-F-T3
,GP-S3-66,What is the recommended disposal method for soiled dressings in a healthcare setting?,Black plastic bag,Incorrect- Black bags are for general domestic and non-infectious waste only.,"Infectious waste bin (e.g., yellow or orange bag)","Correct- Soiled dressings must be disposed of in a designated, color-coded infectious or clinical waste bin to ensure proper segregation and containment.",Recycle bin,"Incorrect- Medical waste, especially if soiled, should never be placed in a recycling bin due to the risk of contamination.",,,B,Contaminated dressings must go in infectious waste bins to prevent cross-contamination.,,FUND – Waste Mgmt,Fundamentals: Waste Mgmt,Easy,,GP-F-I5,GP-F-T3
,GP-S3-67,A hypertensive crisis is suspected when blood pressure (BP) is at or above what reading?,120/80 mmHg,Incorrect- This is considered a normal blood pressure range.,140/90 mmHg,"Incorrect- While this indicates hypertension (high blood pressure), it does not meet the criteria for a hypertensive crisis.",>180/120 mmHg,Correct- A blood pressure reading of 180/120 mmHg or higher is considered a hypertensive crisis.,,,C,"A hypertensive crisis is a medical emergency that requires immediate attention due to the risk of damage to major organs. A BP reading exceeding 180/120 mmHg is the key diagnostic indicator. It is distinct from standard hypertension, and timely intervention is crucial to prevent serious complications",,MED – Cardiovascular,Medicine: Cardiovascular,Hard,,GP-F-I5,GP-F-T3
,GP-S3-68,A patient with a Body Mass Index (BMI) of 36 is classified as:,Normal weight,Incorrect- A normal BMI range is typically 18.5 to 24.9 kg/m².,Obese,Correct- A BMI of 30 kg/m² or higher is classified as obese. A BMI of 36 falls into Obesity Class II (severe obesity).,Overweight,Incorrect- A BMI between 25.0 and 29.9 kg/m² is classified as overweight.,,,B,"Body Mass Index (BMI) is a screening tool used to categorize an individual's weight relative to their height. A BMI of 36 indicates obesity, which is associated with an increased risk of various health problems such as diabetes, heart disease, and hypertension. Regular monitoring of BMI helps in assessing health risks and guiding appropriate interventions",,PHN – Nutrition,Public/community health: Nutritionition,Easy,,GP-F-I5,GP-F-T3
,GP-S3-69,What is the main route of Hepatitis B virus (HBV) transmission?,Contaminated food,"Incorrect- This is the main route for Hepatitis A, not Hepatitis B.",Blood and body fluids,"Correct- HBV is primarily transmitted through contact with infected blood, semen, and other body fluids.",Air,Incorrect- HBV is not an airborne virus and cannot be spread through coughing or sneezing.,,,B,"Hepatitis B is a bloodborne pathogen that spreads through sexual contact, sharing contaminated needles, and from mother to child during childbirth. It is not transmitted through casual contact or airborne means. The vaccine is the most effective way to prevent transmission.",,PHN – Communicable,Public/community health: Communicable,Easy,,GP-F-I5,GP-F-T3
,GP-S3-70,What is the role of a nurse as an advocate?,Administer medication,"Incorrect- This is a routine nursing task, not a specific advocacy function.",Speak up for patient rights,Correct- The advocacy role involves defending patient rights and ensuring their voice is heard.,Diagnose illness,"Incorrect- Diagnosis is a medical role, performed by a physician.",,,B,"As advocates, nurses serve as a crucial link between patients and other healthcare providers. They ensure the patient's perspective, preferences, and rights are respected and considered in all care decisions.",,FUND – Ethics,Fundamentals: Ethicsics,Moderate,,GP-F-I5,GP-F-T3
,GP-S3-71,"Universal precautions, now often referred to as Standard Precautions, are applied to which patient population?",Only patients with confirmed bloodborne infections like HIV or Hepatitis B,"Incorrect- Universal precautions apply to all patients, regardless of their known or suspected infection status.","All patients, assuming all blood and specified body fluids are potentially infectious",Correct- This principle mandates treating all patients and their bodily fluids as potentially infectious to prevent disease transmission.,Pediatric patients exclusively,Incorrect- Standard precautions are used universally for all patient ages.,,,B,Standard precautions ensure consistent infection control by treating all patients as potentially infectious. This protects both healthcare workers and patients.,,FUND – IPC,Fundamentals: IPC,Easy,,GP-F-I5,GP-F-T3
,GP-S3-72,What is the most effective immediate first aid measure for controlling hemorrhage from a wound?,Topical application of powdered styptic agents,Incorrect- This method is ineffective for significant bleeding and can introduce infection or cause tissue damage.,Direct application of continuous external pressure,Correct- Applying firm and continuous pressure directly to the wound promotes hemostasis and is the most immediate and effective action.,Submerging the affected limb in an antiseptic solution,"Incorrect- While useful for wound cleaning after bleeding has stopped, this does not control active hemorrhage and can damage tissue.",,,B,Controlling external bleeding prioritizes applying direct pressure to the wound to facilitate clotting and minimize blood loss. Methods like applying powders or chemical disinfectants are either ineffective for heavy bleeding or can cause further harm and are not part of initial hemorrhage control protocols.,,FUND – First Aid,Fundamentals: First Aid,Easy,,GP-F-I5,GP-F-T3
,GP-S3-73,Which is a characteristic of acute illness?,Lasts for years,Incorrect- An illness that lasts for a long time is defined as a chronic condition.,"Rapid onset, short duration","Correct- Acute illnesses start suddenly and typically resolve within a short period, often less than three months.",Gradual development,"Incorrect- A gradual development of symptoms is characteristic of a chronic, not an acute, illness.",,,B,"Acute illnesses are distinguished from chronic conditions by their rapid onset and short duration. Examples include the common cold, the flu, or a broken bone. Chronic conditions, such as diabetes or heart disease, develop slowly and are long-lasting.",,FUND – Terminology,Fundamentals: Terminology,Easy,,GP-F-I5,GP-F-T3
,GP-S3-74,What does “ad lib” mean in nursing orders?,At bedtime,Incorrect- The abbreviation for at bedtime is h.s. (hora somni).,As desired,"Correct- ""Ad lib"" comes from the Latin phrase ad libitum and means ""as the patient desires"" or ""at liberty"".",Every other day,Incorrect- The abbreviation for every other day is q.o.d. (quaque altera die).,,,B,"""Ad lib"" is a common medical abbreviation used in nursing orders to give patients the freedom to perform an activity as they wish, for instance, ambulating ad lib or consuming fluids ad lib. It empowers the patient while providing a clear instruction for the healthcare team.",,FUND – Abbreviations,Fundamentals: Abbreviations,Easy,,GP-F-I5,GP-F-T3
,GP-S3-75,What is the preferred pulse site for infants?,Carotid,Incorrect- The carotid pulse is not recommended for infants because it is difficult to palpate and their necks are sensitive.,Brachial,"Correct- The brachial pulse is located on the inside of the upper arm and is the easiest and most reliable site for checking a pulse in infants, especially those under one year old.",Radial,Incorrect- The radial pulse at the wrist is often too weak or difficult to locate reliably in infants due to their small size.,,,B,"The brachial pulse is the standard site for pulse assessment in infants, particularly in emergency situations like CPR. Its easy accessibility and stronger signal make it the most reliable choice. For older children, the radial or carotid pulse is more appropriate.",,PEDS – Vital Signs,Paediatrics: Vital Signs,Easy,,GP-F-I5,GP-F-T3
,GP-S3-76,What is tachycardia?,Slow heart rate,Incorrect – bradycardia is slow HR.,Fast heart rate (>100 bpm),Correct – tachycardia is abnormally rapid.,High temperature,Incorrect – fever may cause tachycardia but isn’t the definition.,,,B,"Tachycardia = pulse >100 bpm in adults; may be due to fever, anxiety, hypovolemia, or arrhythmias.",,MED – Cardiac,Medicine: Cardiac,Easy,,GP-F-I5,GP-F-T3
